<?xml version="1.0" encoding="UTF-8"?>
<!--
 *
 * This is a simple Content Management System (CMS)
 * Copyright (C) 2009  Imran M Yousuf (imyousuf@smartitengineering.com)
 *
 * This program is free software: you can redistribute it and/or modify
 * it under the terms of the GNU General Public License as published by
 * the Free Software Foundation, either version 3 of the License, or
 * (at your option) any later version.
 *
 * This program is distributed in the hope that it will be useful,
 * but WITHOUT ANY WARRANTY; without even the implied warranty of
 * MERCHANTABILITY or FITNESS FOR A PARTICULAR PURPOSE.  See the
 * GNU General Public License for more details.
 *
 * You should have received a copy of the GNU General Public License
 * along with this program.  If not, see <http://www.gnu.org/licenses/>.
-->
<xs:schema xmlns:xs="http://www.w3.org/2001/XMLSchema"
xmlns="http://www.smartitengineering.com/smart-cms/content/content-type-schema"
targetNamespace="http://www.smartitengineering.com/smart-cms/content/content-type-schema"
xmlns:xsi="http://www.w3.org/2001/XMLSchema-instance"
xsi:schemaLocation="http://www.w3.org/2001/XMLSchema http://www.w3.org/2001/XMLSchema.xsd"
>
  <xs:simpleType name="smartDate">
    <xs:restriction base="xs:dateTime">
      <xs:pattern value="[1-9][0-9]{3}-[0-9]{2}-[0-9]{2}T[0-2][0-9]:[0-5][0-9]:[0-5][0-9]([+-][0-2][0-9]:[0-5][0-9])"/>
    </xs:restriction>
  </xs:simpleType>
  <xs:element name="mimeType" type="xs:string" />
  <xs:element name="name" type="xs:string" />
  <xs:element name="typeNS" type="xs:string" />
  <xs:element name="typeName" type="xs:string" />
  <xs:element name="bidirectional" type="xs:string" />
  <xs:group name="contentTypeGrp">
    <xs:sequence>
      <xs:element ref="typeNS" minOccurs="1" maxOccurs="1" />
      <xs:element ref="typeName" minOccurs="1" maxOccurs="1" />
    </xs:sequence>
  </xs:group>
  <xs:element name="content">
    <xs:complexType>
      <xs:sequence>
        <xs:group ref="contentTypeGrp" minOccurs="1" maxOccurs="1" />
        <xs:element ref="bidirectional" minOccurs="0" maxOccurs="1" />
      </xs:sequence>
    </xs:complexType>
  </xs:element>
  <xs:element name="long" />
  <xs:element name="integer" />
  <xs:element name="double" />
  <xs:element name="boolean" />
  <xs:element name="datetime" type="smartDate" />
  <xs:element name="encoding" type="xs:string" />
  <xs:element name="string">
    <xs:complexType>
      <xs:sequence>
        <xs:element ref="mimeType" minOccurs="1" maxOccurs="1"/>
        <xs:element ref="encoding" minOccurs="0" maxOccurs="1"/>
      </xs:sequence>
    </xs:complexType>
  </xs:element>
  <xs:element name="other">
    <xs:complexType>
      <xs:sequence>
        <xs:element ref="mimeType" minOccurs="1" maxOccurs="1"/>
      </xs:sequence>
    </xs:complexType>
  </xs:element>
  <xs:element name="size" type="xs:integer" />
  <xs:element name="collection">
    <xs:complexType>
      <xs:sequence>
        <xs:element ref="simple-value" minOccurs="1" maxOccurs="1"/>
        <xs:element ref="size" minOccurs="0" maxOccurs="1"/>
      </xs:sequence>
    </xs:complexType>
  </xs:element>
  <xs:element name="value">
    <xs:complexType>
      <xs:sequence>
        <xs:choice>
          <xs:element ref="content" minOccurs="1" maxOccurs="1" />
          <xs:element ref="long" minOccurs="1" maxOccurs="1" />
          <xs:element ref="integer" minOccurs="1" maxOccurs="1" />
          <xs:element ref="double" minOccurs="1" maxOccurs="1" />
          <xs:element ref="boolean" minOccurs="1" maxOccurs="1" />
          <xs:element ref="datetime" minOccurs="1" maxOccurs="1" />
          <xs:element ref="string" minOccurs="1" maxOccurs="1" />
          <xs:element ref="other" minOccurs="1" maxOccurs="1" />
          <xs:element ref="collection" minOccurs="1" maxOccurs="1" />
        </xs:choice>
      </xs:sequence>
    </xs:complexType>
  </xs:element>
  <xs:element name="simple-value">
    <xs:complexType>
      <xs:sequence>
        <xs:choice>
          <xs:element ref="content" minOccurs="1" maxOccurs="1" />
          <xs:element ref="long" minOccurs="1" maxOccurs="1" />
          <xs:element ref="integer" minOccurs="1" maxOccurs="1" />
          <xs:element ref="double" minOccurs="1" maxOccurs="1" />
          <xs:element ref="boolean" minOccurs="1" maxOccurs="1" />
          <xs:element ref="datetime" minOccurs="1" maxOccurs="1" />
          <xs:element ref="string" minOccurs="1" maxOccurs="1" />
          <xs:element ref="other" minOccurs="1" maxOccurs="1" />
        </xs:choice>
      </xs:sequence>
    </xs:complexType>
  </xs:element>
  <xs:element name="required" type="xs:boolean" />
  <xs:element name="internal">
    <xs:complexType>
      <xs:sequence>
        <xs:element ref="name" minOccurs="1" maxOccurs="1" />
      </xs:sequence>
    </xs:complexType>
  </xs:element>
  <xs:element name="external" type="xs:string" />
  <xs:element name="uri">
    <xs:complexType>
      <xs:sequence>
        <xs:choice>
          <xs:element ref="internal" minOccurs="1" maxOccurs="1" />
          <xs:element ref="external" minOccurs="1" maxOccurs="1" />
        </xs:choice>
      </xs:sequence>
    </xs:complexType>
  </xs:element>
  <xs:element name="templateType">
    <xs:simpleType>
      <xs:restriction base="xs:string">
        <xs:enumeration value="velocity" />
        <xs:enumeration value="ruby" />
        <xs:enumeration value="javascript" />
        <xs:enumeration value="groovy" />
      </xs:restriction>
    </xs:simpleType>
  </xs:element>
  <xs:complexType name="resource">
    <xs:sequence>
      <xs:element ref="name" minOccurs="1" maxOccurs="1" />
      <xs:element ref="mimeType" minOccurs="1" maxOccurs="1" />
      <xs:element ref="templateType" minOccurs="1" maxOccurs="1" />
      <xs:element ref="uri" minOccurs="1" maxOccurs="1" />
    </xs:sequence>
  </xs:complexType>
  <xs:element name="variation" type="resource" />
  <xs:element name="representation" type="resource" />
  <xs:element name="representations">
    <xs:complexType>
      <xs:sequence>
        <xs:element ref="representation" minOccurs="1" maxOccurs="unbounded" />
      </xs:sequence>
    </xs:complexType>
  </xs:element>
  <xs:element name="variations">
    <xs:complexType>
      <xs:sequence>
        <xs:element ref="variation" minOccurs="1" maxOccurs="unbounded" />
      </xs:sequence>
    </xs:complexType>
  </xs:element>
  <xs:element name="field">
    <xs:complexType>
      <xs:sequence>
        <xs:element ref="name" minOccurs="1" maxOccurs="1"/>
        <xs:element ref="value" minOccurs="1" maxOccurs="1"/>
        <xs:element ref="required" minOccurs="0" maxOccurs="1"/>
        <xs:element ref="variations" minOccurs="0" maxOccurs="1"/>
      </xs:sequence>
    </xs:complexType>
  </xs:element>
  <xs:element name="fields">
    <xs:complexType>
      <xs:sequence>
        <xs:element ref="field" minOccurs="1" maxOccurs="unbounded" />
      </xs:sequence>
    </xs:complexType>
  </xs:element>
  <xs:element name="parentTypeNS" type="xs:string" />
  <xs:element name="parentTypeName" type="xs:string" />
  <xs:group name="parentType">
    <xs:sequence>
      <xs:element ref="parentTypeNS" minOccurs="1" maxOccurs="1" />
      <xs:element ref="parentTypeName" minOccurs="1" maxOccurs="1" />
    </xs:sequence>
  </xs:group>
  <xs:element name="statusName" type="xs:string" />
  <xs:element name="status">
    <xs:complexType>
      <xs:sequence>
        <xs:element ref="statusName" minOccurs="1" maxOccurs="unbounded" />
      </xs:sequence>
    </xs:complexType>
  </xs:element>
  <xs:element name="contentType">
    <xs:complexType>
      <xs:sequence>
        <xs:element ref="name" minOccurs="1" maxOccurs="1" />
        <xs:group ref="parentType" minOccurs="0" maxOccurs="1" />
        <xs:element ref="fields" minOccurs="1" />
        <xs:element ref="status" minOccurs="1" maxOccurs="1" />
        <xs:element ref="representations" minOccurs="0" maxOccurs="1" />
      </xs:sequence>
      <xs:attribute name="namespace" type="xs:string" use="required" />
    </xs:complexType>
  </xs:element>
  <xs:element name="contentTypes">
    <xs:complexType>
      <xs:sequence>
        <xs:element ref="contentType" minOccurs="1" maxOccurs="unbounded" />
      </xs:sequence>
    </xs:complexType>
  </xs:element>
</xs:schema>
