<?xml version="1.0" encoding="UTF-8"?>
<!--
 *
 * This is a simple Content Management System (CMS)
 * Copyright (C) 2009  Imran M Yousuf (imyousuf@smartitengineering.com)
 *
 * This program is free software: you can redistribute it and/or modify
 * it under the terms of the GNU General Public License as published by
 * the Free Software Foundation, either version 3 of the License, or
 * (at your option) any later version.
 *
 * This program is distributed in the hope that it will be useful,
 * but WITHOUT ANY WARRANTY; without even the implied warranty of
 * MERCHANTABILITY or FITNESS FOR A PARTICULAR PURPOSE.  See the
 * GNU General Public License for more details.
 *
 * You should have received a copy of the GNU General Public License
 * along with this program.  If not, see <http://www.gnu.org/licenses/>.
-->
<!--
    Document   : content-type-def-product.xml
    Created on : September 25, 2009, 5:20 PM
    Author     : imyousuf
    Description:
        A sample content type definition in context of smart shopping
-->
<contentTypes xmlns="http://www.smartitengineering.com/smart-cms/content/content-type-schema"
              xmlns:xsi="http://www.w3.org/2001/XMLSchema-instance"
              xsi:schemaLocation="http://www.smartitengineering.com/smart-cms/content/content-type-schema http://github.com/smart-it/smart-cms/raw/master/content-api-impl/src/main/resources/com/smartitengineering/cms/content/content-type-schema.xsd">

  <contentType namespace="com.smartitengineering.smart-shopping.content">
    <name>Book</name>
    <primaryField>isbn</primaryField>
    <fields>
      <field>
        <name>isbn</name>
        <value>
          <string>
            <mimeType>text/plain</mimeType>
          </string>
        </value>
        <required>true</required>
        <variations>
          <variation>
            <name>avar</name>
            <mimeType>some/type</mimeType>
            <uri>
              <external>http://some/uri</external>
            </uri>
          </variation>
          <variation>
            <name>anothervar</name>
            <mimeType>some/type</mimeType>
            <uri>
              <internal>
                <name>internalvar</name>
              </internal>
            </uri>
          </variation>
        </variations>
        <search>
          <index>true</index>
          <store>false</store>
          <boost>a</boost>
        </search>
      </field>
      <field>
        <name>publishers</name>
        <value>
          <collection>
            <simple-value>
              <content>
                <definition>
                  <typeNS>com.smartitengineering.smart-shopping.content</typeNS>
                  <typeName>Publisher</typeName>
                </definition>
              </content>
            </simple-value>
            <maxSize>30</maxSize>
          </collection>
        </value>
        <required>true</required>
        <variations>
          <variation>
            <name>avar</name>
            <mimeType>some/type</mimeType>
            <uri>
              <external>http://some/uri</external>
            </uri>
          </variation>
          <variation>
            <name>anothervar</name>
            <mimeType>some/type</mimeType>
            <uri>
              <internal>
                <name>internalvar</name>
              </internal>
            </uri>
          </variation>
        </variations>
      </field>
      <field>
        <name>authors</name>
        <value>
          <collection>
            <simple-value>
              <content>
                <definition>
                  <typeNS>com.smartitengineering.smart-shopping.content</typeNS>
                  <typeName>Author</typeName>
                </definition>
              </content>
            </simple-value>
          </collection>
        </value>
        <required>true</required>
        <variations>
          <variation>
            <name>avar</name>
            <mimeType>some/type</mimeType>
            <uri>
              <external>http://some/uri</external>
            </uri>
          </variation>
          <variation>
            <name>anothervar</name>
            <mimeType>some/type</mimeType>
            <uri>
              <internal>
                <name>internalvar</name>
              </internal>
            </uri>
          </variation>
        </variations>
      </field>
    </fields>
    <status>
      <statusName>draft</statusName>
      <statusName>marketed</statusName>
      <statusName>obselete</statusName>
    </status>
    <representations>
      <representation>
        <name>arep</name>
        <mimeType>some/type</mimeType>
        <uri>
          <external>http://some/uri</external>
        </uri>
      </representation>
      <representation>
        <name>anotherrep</name>
        <mimeType>some/type</mimeType>
        <uri>
          <internal>
            <name>internalrep</name>
          </internal>
        </uri>
      </representation>
    </representations>
  </contentType>

  <contentType namespace="com.smartitengineering.smart-shopping.content">
    <name>Publisher</name>
    <parent>
      <typeNS>com.smartitengineering.smart-shopping.content</typeNS>
      <typeName>Book</typeName>
    </parent>
    <fields>
      <field>
        <name>name</name>
        <value>
          <string>
            <mimeType>text/plain</mimeType>
          </string>
        </value>
        <variations>
          <variation>
            <name>avar</name>
            <mimeType>some/type</mimeType>
            <uri>
              <external>http://some/uri</external>
            </uri>
          </variation>
          <variation>
            <name>anothervar</name>
            <mimeType>some/type</mimeType>
            <uri>
              <internal>
                <name>internalvar</name>
              </internal>
            </uri>
          </variation>
        </variations>
      </field>
    </fields>
    <status>
      <statusName>draft</statusName>
      <statusName>marketed</statusName>
      <statusName>obselete</statusName>
    </status>
    <representations>
      <representation>
        <name>arep</name>
        <mimeType>some/type</mimeType>
        <uri>
          <external>http://some/uri</external>
        </uri>
      </representation>
      <representation>
        <name>anotherrep</name>
        <mimeType>some/type</mimeType>
        <uri>
          <internal>
            <name>internalrep</name>
          </internal>
        </uri>
      </representation>
    </representations>
  </contentType>

  <contentType namespace="com.smartitengineering.smart-shopping.content">
    <name>Author</name>
    <parent>
      <typeNS>com.smartitengineering.smart-shopping.content</typeNS>
      <typeName>Book</typeName>
    </parent>
    <fields>
      <field>
        <name>name</name>
        <value>
          <string>
            <mimeType>text/plain</mimeType>
          </string>
        </value>
        <variations>
          <variation>
            <name>avar</name>
            <mimeType>some/type</mimeType>
            <uri>
              <external>http://some/uri</external>
            </uri>
          </variation>
          <variation>
            <name>anothervar</name>
            <mimeType>some/type</mimeType>
            <uri>
              <internal>
                <name>internalvar</name>
              </internal>
            </uri>
          </variation>
        </variations>
      </field>
      <field>
        <name>books</name>
        <value>
          <collection>
            <simple-value>
              <content>
                <definition>
                  <typeNS>com.smartitengineering.smart-shopping.content</typeNS>
                  <typeName>Book</typeName>
                </definition>
                <bidirectional>authors</bidirectional>
              </content>
            </simple-value>
          </collection>
        </value>
        <variations>
          <variation>
            <name>avar</name>
            <mimeType>some/type</mimeType>
            <uri>
              <external>http://some/uri</external>
            </uri>
          </variation>
          <variation>
            <name>anothervar</name>
            <mimeType>some/type</mimeType>
            <uri>
              <internal>
                <name>internalvar</name>
              </internal>
            </uri>
          </variation>
        </variations>
      </field>
    </fields>
    <status>
      <statusName>draft</statusName>
      <statusName>published</statusName>
    </status>
  </contentType>
</contentTypes>
